{
  "header": {
    "artifactId": "WF_PRODUCTION_FEATURE",
    "version": "1.0",
    "status": "FROZEN",
    "schemaVersion": "1.0",
    "layer": "CORE",
    "governedBy": [
      "PAF-SPEC",
      "PAF-BINDING-MODEL"
    ],
    "createdAt": "2026-08-13T10:01:00-04:00",
    "frozenAt": "2026-08-13T15:26:10-04:00",
    "frozenUnder": "APR-002 (Step 54 owner approval)"
  },
  "workflowId": "WF_PRODUCTION_FEATURE",
  "displayName": "Production Feature",
  "appliesToWorkTypes": [
    "FEATURE_SLICE"
  ],
  "riskSensitivity": "Stage sequence is invariant across risk classes. Higher risk thickens the control bundle at each gate: more evidence classes, stricter independence mechanism, and additional human approval.",
  "stageSequence": [
    {
      "stageClass": "INTAKE",
      "owningRole": "ROLE_ORCHESTRATOR"
    },
    {
      "stageClass": "CLASSIFICATION",
      "owningRole": "ROLE_ORCHESTRATOR"
    },
    {
      "stageClass": "DESIGN",
      "owningRole": "ROLE_ARCHITECTURE",
      "participatingRoles": [
        "ROLE_UX_DESIGN"
      ]
    },
    {
      "stageClass": "TEST_DEFINITION",
      "owningRole": "ROLE_QUALITY"
    },
    {
      "stageClass": "IMPLEMENTATION",
      "owningRole": "ROLE_CODING"
    },
    {
      "stageClass": "INTEGRATION",
      "owningRole": "ROLE_CODING",
      "participatingRoles": [
        "ROLE_TEST_DEBUG"
      ]
    },
    {
      "stageClass": "VERIFICATION",
      "owningRole": "ROLE_QUALITY",
      "participatingRoles": [
        "ROLE_TEST_DEBUG",
        "ROLE_GUI_GOVERNANCE"
      ]
    },
    {
      "stageClass": "DOCUMENTATION",
      "owningRole": "ROLE_TECH_DOC",
      "participatingRoles": [
        "ROLE_ENDUSER_DOC"
      ]
    },
    {
      "stageClass": "SECURITY_RELEASE_REVIEW",
      "owningRole": "ROLE_SECURITY_RELEASE"
    },
    {
      "stageClass": "OWNER_APPROVAL",
      "owningRole": "ROLE_ORCHESTRATOR"
    },
    {
      "stageClass": "DEPLOYMENT",
      "owningRole": "ROLE_SECURITY_RELEASE"
    },
    {
      "stageClass": "OBSERVATION",
      "owningRole": "ROLE_SECURITY_RELEASE"
    },
    {
      "stageClass": "STABILIZATION",
      "owningRole": "ROLE_SECURITY_RELEASE"
    }
  ],
  "gates": [
    {
      "gateId": "G_PF_DESIGN",
      "afterStageClass": "DESIGN",
      "requiredEvidenceClasses": [
        "DESIGN_RECORD",
        "IMPACT_ANALYSIS"
      ],
      "closureAuthority": [
        "INDEPENDENT_REVIEW"
      ],
      "independenceRequired": true,
      "exceptionEligible": false
    },
    {
      "gateId": "G_PF_TESTS",
      "afterStageClass": "TEST_DEFINITION",
      "requiredEvidenceClasses": [
        "TEST_SPECIFICATION",
        "ACCEPTANCE_CRITERIA"
      ],
      "closureAuthority": [
        "INDEPENDENT_REVIEW"
      ],
      "independenceRequired": true,
      "exceptionEligible": false
    },
    {
      "gateId": "G_PF_IMPL",
      "afterStageClass": "INTEGRATION",
      "requiredEvidenceClasses": [
        "TEST_RESULT",
        "STATIC_CHECK_RESULT"
      ],
      "closureAuthority": [
        "DETERMINISTIC_CHECK"
      ],
      "independenceRequired": false,
      "exceptionEligible": false
    },
    {
      "gateId": "G_PF_VERIFIED",
      "afterStageClass": "VERIFICATION",
      "requiredEvidenceClasses": [
        "VERIFICATION_RECORD",
        "COVERAGE_REPORT",
        "VISUAL_REGRESSION_RESULT",
        "RECOVERY_VERIFICATION"
      ],
      "closureAuthority": [
        "DETERMINISTIC_CHECK",
        "INDEPENDENT_REVIEW"
      ],
      "independenceRequired": true,
      "exceptionEligible": false
    },
    {
      "gateId": "G_PF_DOCS",
      "afterStageClass": "DOCUMENTATION",
      "requiredEvidenceClasses": [
        "DOCUMENTATION_UPDATE_RECORD"
      ],
      "closureAuthority": [
        "DETERMINISTIC_CHECK"
      ],
      "independenceRequired": false,
      "exceptionEligible": false
    },
    {
      "gateId": "G_PF_SECURITY",
      "afterStageClass": "SECURITY_RELEASE_REVIEW",
      "requiredEvidenceClasses": [
        "SECURITY_REVIEW_RECORD",
        "TENANT_ISOLATION_VERIFICATION",
        "SECURITY_SCAN_RESULT"
      ],
      "closureAuthority": [
        "DETERMINISTIC_CHECK",
        "INDEPENDENT_REVIEW"
      ],
      "independenceRequired": true,
      "exceptionEligible": false
    },
    {
      "gateId": "G_PF_RELEASE",
      "afterStageClass": "OWNER_APPROVAL",
      "requiredEvidenceClasses": [
        "RELEASE_READINESS_RECORD",
        "RESIDUAL_RISK_RECORD",
        "HUMAN_APPROVAL_RECORD"
      ],
      "closureAuthority": [
        "HUMAN_APPROVAL"
      ],
      "independenceRequired": false,
      "exceptionEligible": false,
      "humanApprovalCategoryRef": "PRODUCTION_RELEASE"
    },
    {
      "gateId": "G_PF_OBSERVED",
      "afterStageClass": "OBSERVATION",
      "requiredEvidenceClasses": [
        "OBSERVATION_RECORD",
        "PERFORMANCE_MEASUREMENT"
      ],
      "closureAuthority": [
        "DETERMINISTIC_CHECK"
      ],
      "independenceRequired": false,
      "exceptionEligible": false
    },
    {
      "gateId": "G_PF_STABLE",
      "afterStageClass": "STABILIZATION",
      "requiredEvidenceClasses": [
        "HUMAN_APPROVAL_RECORD"
      ],
      "closureAuthority": [
        "HUMAN_APPROVAL"
      ],
      "independenceRequired": false,
      "exceptionEligible": false,
      "humanApprovalCategoryRef": "STABLE_STATUS"
    }
  ],
  "terminalConditions": [
    "Stable status approved by owner",
    "Rolled back with recovery evidence"
  ],
  "stopConditions": [
    "Tenant isolation cannot be demonstrated",
    "Recovery procedure is unverified",
    "Evidence would have to be assumed"
  ]
}