{
  "header": {
    "artifactId": "WF_SECURITY",
    "version": "1.0",
    "status": "FROZEN",
    "schemaVersion": "1.0",
    "layer": "CORE",
    "governedBy": [
      "PAF-SPEC",
      "PAF-BINDING-MODEL"
    ],
    "createdAt": "2026-08-13T10:01:00-04:00",
    "frozenAt": "2026-08-13T15:26:10-04:00",
    "frozenUnder": "APR-002 (Step 54 owner approval)"
  },
  "workflowId": "WF_SECURITY",
  "displayName": "Security Change",
  "appliesToWorkTypes": [
    "SECURITY_CHANGE",
    "TENANT_ISOLATION_CHANGE",
    "SECRET_HANDLING_CHANGE"
  ],
  "riskSensitivity": "Stage sequence is invariant across risk classes. Higher risk thickens the control bundle at each gate: more evidence classes, stricter independence mechanism, and additional human approval.",
  "stageSequence": [
    {
      "stageClass": "INTAKE",
      "owningRole": "ROLE_ORCHESTRATOR"
    },
    {
      "stageClass": "CLASSIFICATION",
      "owningRole": "ROLE_ORCHESTRATOR"
    },
    {
      "stageClass": "DESIGN",
      "owningRole": "ROLE_ARCHITECTURE",
      "participatingRoles": [
        "ROLE_SECURITY_RELEASE"
      ]
    },
    {
      "stageClass": "IMPLEMENTATION",
      "owningRole": "ROLE_CODING"
    },
    {
      "stageClass": "VERIFICATION",
      "owningRole": "ROLE_QUALITY"
    },
    {
      "stageClass": "SECURITY_RELEASE_REVIEW",
      "owningRole": "ROLE_SECURITY_RELEASE"
    },
    {
      "stageClass": "OWNER_APPROVAL",
      "owningRole": "ROLE_ORCHESTRATOR"
    }
  ],
  "gates": [
    {
      "gateId": "G_SEC_DESIGN",
      "afterStageClass": "DESIGN",
      "requiredEvidenceClasses": [
        "DESIGN_RECORD",
        "THREAT_ANALYSIS"
      ],
      "closureAuthority": [
        "INDEPENDENT_REVIEW",
        "DETERMINISTIC_CHECK"
      ],
      "independenceRequired": true,
      "exceptionEligible": false
    },
    {
      "gateId": "G_SEC_VERIFIED",
      "afterStageClass": "VERIFICATION",
      "requiredEvidenceClasses": [
        "SECURITY_SCAN_RESULT",
        "TENANT_ISOLATION_VERIFICATION"
      ],
      "closureAuthority": [
        "DETERMINISTIC_CHECK"
      ],
      "independenceRequired": false,
      "exceptionEligible": false
    },
    {
      "gateId": "G_SEC_APPROVED",
      "afterStageClass": "OWNER_APPROVAL",
      "requiredEvidenceClasses": [
        "HUMAN_APPROVAL_RECORD"
      ],
      "closureAuthority": [
        "HUMAN_APPROVAL"
      ],
      "independenceRequired": false,
      "exceptionEligible": false,
      "humanApprovalCategoryRef": "SECURITY_POLICY"
    }
  ],
  "terminalConditions": [
    "Owner approves the security change"
  ],
  "stopConditions": [
    "A global non-waivable invariant would be pierced"
  ]
}