{
  "header": {
    "artifactId": "WF_EMERGENCY",
    "version": "1.0",
    "status": "FROZEN",
    "schemaVersion": "1.0",
    "layer": "CORE",
    "governedBy": [
      "PAF-SPEC",
      "PAF-BINDING-MODEL"
    ],
    "createdAt": "2026-08-13T10:01:00-04:00",
    "frozenAt": "2026-08-13T15:26:10-04:00",
    "frozenUnder": "APR-002 (Step 54 owner approval)"
  },
  "workflowId": "WF_EMERGENCY",
  "displayName": "Emergency Containment",
  "appliesToWorkTypes": [
    "EMERGENCY",
    "INCIDENT_CONTAINMENT"
  ],
  "riskSensitivity": "Emergency may accelerate sequencing and documentation TIMING only. It never converts a non-waivable control, pierces a global invariant, or manufactures approval.",
  "stageSequence": [
    {
      "stageClass": "INTAKE",
      "owningRole": "ROLE_ORCHESTRATOR"
    },
    {
      "stageClass": "IMPLEMENTATION",
      "owningRole": "ROLE_CODING"
    },
    {
      "stageClass": "SECURITY_RELEASE_REVIEW",
      "owningRole": "ROLE_SECURITY_RELEASE"
    },
    {
      "stageClass": "OWNER_APPROVAL",
      "owningRole": "ROLE_ORCHESTRATOR"
    },
    {
      "stageClass": "DOCUMENTATION",
      "owningRole": "ROLE_TECH_DOC"
    }
  ],
  "gates": [
    {
      "gateId": "G_EM_CONTAINED",
      "afterStageClass": "IMPLEMENTATION",
      "requiredEvidenceClasses": [
        "CONTAINMENT_RECORD",
        "RECOVERY_VERIFICATION"
      ],
      "closureAuthority": [
        "DETERMINISTIC_CHECK"
      ],
      "independenceRequired": false,
      "exceptionEligible": false
    },
    {
      "gateId": "G_EM_REVIEWED",
      "afterStageClass": "SECURITY_RELEASE_REVIEW",
      "requiredEvidenceClasses": [
        "SECURITY_REVIEW_RECORD"
      ],
      "closureAuthority": [
        "INDEPENDENT_REVIEW"
      ],
      "independenceRequired": true,
      "exceptionEligible": false
    },
    {
      "gateId": "G_EM_RETROSPECTIVE",
      "afterStageClass": "OWNER_APPROVAL",
      "requiredEvidenceClasses": [
        "HUMAN_APPROVAL_RECORD",
        "RESIDUAL_RISK_RECORD"
      ],
      "closureAuthority": [
        "HUMAN_APPROVAL"
      ],
      "independenceRequired": false,
      "exceptionEligible": false,
      "humanApprovalCategoryRef": "MATERIAL_RESIDUAL_RISK"
    }
  ],
  "terminalConditions": [
    "Containment closed and retrospectively approved"
  ],
  "stopConditions": [
    "A non-waivable control would be treated as waived because of urgency"
  ]
}