{
  "header": {
    "artifactId": "WF_PRODUCT_DECISION",
    "version": "1.0",
    "status": "FROZEN",
    "schemaVersion": "1.0",
    "layer": "CORE",
    "governedBy": [
      "PAF-SPEC",
      "PAF-BINDING-MODEL"
    ],
    "createdAt": "2026-08-13T10:01:00-04:00",
    "frozenAt": "2026-08-13T15:26:10-04:00",
    "frozenUnder": "APR-002 (Step 54 owner approval)"
  },
  "workflowId": "WF_PRODUCT_DECISION",
  "displayName": "Product Decision",
  "appliesToWorkTypes": [
    "PRODUCT_SCOPE_CHANGE",
    "ACCEPTANCE_CRITERIA_CHANGE"
  ],
  "riskSensitivity": "Stage sequence is invariant across risk classes. Higher risk thickens the control bundle at each gate: more evidence classes, stricter independence mechanism, and additional human approval.",
  "stageSequence": [
    {
      "stageClass": "INTAKE",
      "owningRole": "ROLE_ORCHESTRATOR"
    },
    {
      "stageClass": "CLASSIFICATION",
      "owningRole": "ROLE_ORCHESTRATOR"
    },
    {
      "stageClass": "DESIGN",
      "owningRole": "ROLE_ARCHITECTURE",
      "participatingRoles": [
        "ROLE_UX_DESIGN"
      ]
    },
    {
      "stageClass": "OWNER_APPROVAL",
      "owningRole": "ROLE_ORCHESTRATOR"
    },
    {
      "stageClass": "DOCUMENTATION",
      "owningRole": "ROLE_TECH_DOC"
    }
  ],
  "gates": [
    {
      "gateId": "G_PD_CLASSIFIED",
      "afterStageClass": "CLASSIFICATION",
      "requiredEvidenceClasses": [
        "RISK_CLASSIFICATION_RECORD"
      ],
      "closureAuthority": [
        "DETERMINISTIC_CHECK"
      ],
      "independenceRequired": false,
      "exceptionEligible": false
    },
    {
      "gateId": "G_PD_OPTIONS",
      "afterStageClass": "DESIGN",
      "requiredEvidenceClasses": [
        "DECISION_RECORD",
        "IMPACT_ANALYSIS"
      ],
      "closureAuthority": [
        "INDEPENDENT_REVIEW"
      ],
      "independenceRequired": true,
      "exceptionEligible": false
    },
    {
      "gateId": "G_PD_APPROVED",
      "afterStageClass": "OWNER_APPROVAL",
      "requiredEvidenceClasses": [
        "HUMAN_APPROVAL_RECORD"
      ],
      "closureAuthority": [
        "HUMAN_APPROVAL"
      ],
      "independenceRequired": false,
      "exceptionEligible": false,
      "humanApprovalCategoryRef": "PRODUCT_SCOPE_ACCEPTANCE"
    }
  ],
  "terminalConditions": [
    "Owner records an explicit decision",
    "Work is withdrawn or superseded"
  ],
  "stopConditions": [
    "A non-waivable control would be weakened",
    "Required human approval unavailable",
    "Required independent review unachievable",
    "Equal-authority source conflict on a material subject"
  ]
}