{
  "header": {
    "artifactId": "WF_UPGRADE",
    "version": "1.0",
    "status": "FROZEN",
    "schemaVersion": "1.0",
    "layer": "CORE",
    "governedBy": [
      "PAF-SPEC",
      "PAF-BINDING-MODEL"
    ],
    "createdAt": "2026-08-13T10:01:00-04:00",
    "frozenAt": "2026-08-13T15:26:10-04:00",
    "frozenUnder": "APR-002 (Step 54 owner approval)"
  },
  "workflowId": "WF_UPGRADE",
  "displayName": "Dependency / Upgrade",
  "appliesToWorkTypes": [
    "DEPENDENCY_UPGRADE",
    "RUNTIME_UPGRADE",
    "TOOLING_CHANGE"
  ],
  "riskSensitivity": "Stage sequence is invariant across risk classes. Higher risk thickens the control bundle at each gate: more evidence classes, stricter independence mechanism, and additional human approval.",
  "stageSequence": [
    {
      "stageClass": "INTAKE",
      "owningRole": "ROLE_ORCHESTRATOR"
    },
    {
      "stageClass": "CLASSIFICATION",
      "owningRole": "ROLE_ORCHESTRATOR"
    },
    {
      "stageClass": "IMPLEMENTATION",
      "owningRole": "ROLE_CODING"
    },
    {
      "stageClass": "VERIFICATION",
      "owningRole": "ROLE_QUALITY"
    },
    {
      "stageClass": "SECURITY_RELEASE_REVIEW",
      "owningRole": "ROLE_SECURITY_RELEASE"
    }
  ],
  "gates": [
    {
      "gateId": "G_UP_REGRESSION",
      "afterStageClass": "VERIFICATION",
      "requiredEvidenceClasses": [
        "REGRESSION_RESULT",
        "COVERAGE_REPORT"
      ],
      "closureAuthority": [
        "DETERMINISTIC_CHECK"
      ],
      "independenceRequired": false,
      "exceptionEligible": false
    },
    {
      "gateId": "G_UP_SECURITY",
      "afterStageClass": "SECURITY_RELEASE_REVIEW",
      "requiredEvidenceClasses": [
        "SECURITY_SCAN_RESULT"
      ],
      "closureAuthority": [
        "DETERMINISTIC_CHECK",
        "INDEPENDENT_REVIEW"
      ],
      "independenceRequired": true,
      "exceptionEligible": false
    }
  ],
  "terminalConditions": [
    "Upgrade verified with regression and security evidence"
  ],
  "stopConditions": [
    "A non-waivable control would be weakened",
    "Required human approval unavailable",
    "Required independent review unachievable",
    "Equal-authority source conflict on a material subject"
  ]
}