{
  "header": {
    "artifactId": "WF_EXCEPTION",
    "version": "1.0",
    "status": "FROZEN",
    "schemaVersion": "1.0",
    "layer": "CORE",
    "governedBy": [
      "PAF-SPEC",
      "PAF-BINDING-MODEL"
    ],
    "createdAt": "2026-08-13T10:01:00-04:00",
    "frozenAt": "2026-08-13T15:26:10-04:00",
    "frozenUnder": "APR-002 (Step 54 owner approval)"
  },
  "workflowId": "WF_EXCEPTION",
  "displayName": "Exception Request",
  "appliesToWorkTypes": [
    "EXCEPTION_REQUEST"
  ],
  "riskSensitivity": "Stage sequence is invariant across risk classes. Higher risk thickens the control bundle at each gate: more evidence classes, stricter independence mechanism, and additional human approval.",
  "stageSequence": [
    {
      "stageClass": "INTAKE",
      "owningRole": "ROLE_ORCHESTRATOR"
    },
    {
      "stageClass": "CLASSIFICATION",
      "owningRole": "ROLE_ORCHESTRATOR"
    },
    {
      "stageClass": "SECURITY_RELEASE_REVIEW",
      "owningRole": "ROLE_SECURITY_RELEASE"
    },
    {
      "stageClass": "OWNER_APPROVAL",
      "owningRole": "ROLE_ORCHESTRATOR"
    }
  ],
  "gates": [
    {
      "gateId": "G_EX_ELIGIBLE",
      "afterStageClass": "CLASSIFICATION",
      "requiredEvidenceClasses": [
        "ELIGIBILITY_DETERMINATION"
      ],
      "closureAuthority": [
        "DETERMINISTIC_CHECK"
      ],
      "independenceRequired": false,
      "exceptionEligible": false
    },
    {
      "gateId": "G_EX_COMPENSATED",
      "afterStageClass": "SECURITY_RELEASE_REVIEW",
      "requiredEvidenceClasses": [
        "COMPENSATING_CONTROL_RECORD",
        "EXPIRY_RECORD"
      ],
      "closureAuthority": [
        "INDEPENDENT_REVIEW"
      ],
      "independenceRequired": true,
      "exceptionEligible": false
    },
    {
      "gateId": "G_EX_APPROVED",
      "afterStageClass": "OWNER_APPROVAL",
      "requiredEvidenceClasses": [
        "HUMAN_APPROVAL_RECORD"
      ],
      "closureAuthority": [
        "HUMAN_APPROVAL"
      ],
      "independenceRequired": false,
      "exceptionEligible": false,
      "humanApprovalCategoryRef": "GOVERNANCE_EXCEPTION"
    }
  ],
  "terminalConditions": [
    "Exception granted with expiry and compensating controls",
    "Exception refused as ineligible"
  ],
  "stopConditions": [
    "The target control is non-waivable",
    "A global non-waivable invariant would be pierced",
    "No expiry or compensating control can be defined"
  ]
}