{
  "header": {
    "artifactId": "WF_ARCHITECTURE",
    "version": "1.0",
    "status": "FROZEN",
    "schemaVersion": "1.0",
    "layer": "CORE",
    "governedBy": [
      "PAF-SPEC",
      "PAF-BINDING-MODEL"
    ],
    "createdAt": "2026-08-13T10:01:00-04:00",
    "frozenAt": "2026-08-13T15:26:10-04:00",
    "frozenUnder": "APR-002 (Step 54 owner approval)"
  },
  "workflowId": "WF_ARCHITECTURE",
  "displayName": "Architecture Change",
  "appliesToWorkTypes": [
    "ARCHITECTURE_CHANGE",
    "SHARED_PLATFORM_PROMOTION",
    "CONTRACT_CHANGE"
  ],
  "riskSensitivity": "Stage sequence is invariant across risk classes. Higher risk thickens the control bundle at each gate: more evidence classes, stricter independence mechanism, and additional human approval.",
  "stageSequence": [
    {
      "stageClass": "INTAKE",
      "owningRole": "ROLE_ORCHESTRATOR"
    },
    {
      "stageClass": "CLASSIFICATION",
      "owningRole": "ROLE_ORCHESTRATOR"
    },
    {
      "stageClass": "DESIGN",
      "owningRole": "ROLE_ARCHITECTURE",
      "participatingRoles": [
        "ROLE_METHODOLOGY"
      ]
    },
    {
      "stageClass": "VERIFICATION",
      "owningRole": "ROLE_QUALITY"
    },
    {
      "stageClass": "OWNER_APPROVAL",
      "owningRole": "ROLE_ORCHESTRATOR"
    },
    {
      "stageClass": "DOCUMENTATION",
      "owningRole": "ROLE_TECH_DOC"
    }
  ],
  "gates": [
    {
      "gateId": "G_ARCH_IMPACT",
      "afterStageClass": "DESIGN",
      "requiredEvidenceClasses": [
        "IMPACT_ANALYSIS",
        "CONSUMER_IDENTIFICATION",
        "DEFERRAL_RECORD"
      ],
      "closureAuthority": [
        "INDEPENDENT_REVIEW",
        "DETERMINISTIC_CHECK"
      ],
      "independenceRequired": true,
      "exceptionEligible": false
    },
    {
      "gateId": "G_ARCH_VERIFIED",
      "afterStageClass": "VERIFICATION",
      "requiredEvidenceClasses": [
        "CONTRACT_COMPARISON_RESULT",
        "REGRESSION_RESULT"
      ],
      "closureAuthority": [
        "DETERMINISTIC_CHECK"
      ],
      "independenceRequired": false,
      "exceptionEligible": false
    },
    {
      "gateId": "G_ARCH_APPROVED",
      "afterStageClass": "OWNER_APPROVAL",
      "requiredEvidenceClasses": [
        "HUMAN_APPROVAL_RECORD",
        "RESIDUAL_RISK_RECORD"
      ],
      "closureAuthority": [
        "HUMAN_APPROVAL"
      ],
      "independenceRequired": false,
      "exceptionEligible": false,
      "humanApprovalCategoryRef": "MATERIAL_ARCHITECTURE"
    }
  ],
  "terminalConditions": [
    "Approved and documented",
    "Rejected with recorded basis"
  ],
  "stopConditions": [
    "Structural design would be deferred without declaration",
    "Shared platform would absorb feature behavior"
  ]
}